{
  "firstName": "Jordan",
  "lastName": "Reyes",
  "email": "candidate@example.com",
  "phone": "+1-415-555-0123",
  "source": {
    "id": "11111111-2222-3333-4444-555555555555",
    "descriptor": "Senior Software Engineer"
  },
  "jobRequisition": {
    "id": "11111111-2222-3333-4444-555555555555",
    "descriptor": "Senior Software Engineer"
  }
}
